{
  "acquisition_status": "BLOCKED",
  "attempted_http_requests": 0,
  "collection_started_at": "2026-10-14T18:48:46Z",
  "network_policy_state": "target_not_allowlisted",
  "records": [
    {
      "block_reason": "m3.material.io is absent from restricted HTTP egress rules",
      "canonical_url": "https://m3.material.io/components/all-buttons",
      "discovery_state": "DISCOVERED",
      "integration_state": "NOT INTEGRATED",
      "page_content_obtained": false,
      "retrieval_method": "not_attempted_network_policy_gate",
      "retrieval_state": "BLOCKED",
      "retrieved_at": "2026-10-14T18:48:46Z",
      "state": "blocked",
      "title": "Material components and anatomy",
      "tls_verification": "enabled_no_request_made",
      "topic_id": "material3_components",
      "verification_state": "NOT VERIFIED",
      "verified": false
    },
    {
      "block_reason": "m3.material.io is absent from restricted HTTP egress rules",
      "canonical_url": "https://m3.material.io/components/app-bars/accessibility",
      "discovery_state": "DISCOVERED",
      "integration_state": "NOT INTEGRATED",
      "page_content_obtained": false,
      "retrieval_method": "not_attempted_network_policy_gate",
      "retrieval_state": "BLOCKED",
      "retrieved_at": "2026-10-14T18:48:46Z",
      "state": "blocked",
      "title": "Accessibility, assistive technology, and text adaptation",
      "tls_verification": "enabled_no_request_made",
      "topic_id": "material3_accessibility",
      "verification_state": "NOT VERIFIED",
      "verified": false
    },
    {
      "block_reason": "m3.material.io is absent from restricted HTTP egress rules",
      "canonical_url": "https://m3.material.io/foundations/customization",
      "discovery_state": "DISCOVERED",
      "integration_state": "NOT INTEGRATED",
      "page_content_obtained": false,
      "retrieval_method": "not_attempted_network_policy_gate",
      "retrieval_state": "BLOCKED",
      "retrieved_at": "2026-10-14T18:48:46Z",
      "state": "blocked",
      "title": "Foundations and design principles",
      "tls_verification": "enabled_no_request_made",
      "topic_id": "material3_foundations",
      "verification_state": "NOT VERIFIED",
      "verified": false
    },
    {
      "block_reason": "m3.material.io is absent from restricted HTTP egress rules",
      "canonical_url": "https://m3.material.io/styles/color/advanced/adjust-existing-colors",
      "discovery_state": "DISCOVERED",
      "integration_state": "NOT INTEGRATED",
      "page_content_obtained": false,
      "retrieval_method": "not_attempted_network_policy_gate",
      "retrieval_state": "BLOCKED",
      "retrieved_at": "2026-10-14T18:48:46Z",
      "state": "blocked",
      "title": "Color systems and roles",
      "tls_verification": "enabled_no_request_made",
      "topic_id": "material3_color",
      "verification_state": "NOT VERIFIED",
      "verified": false
    },
    {
      "block_reason": "m3.material.io is absent from restricted HTTP egress rules",
      "canonical_url": "https://m3.material.io/styles/typography/applying-type",
      "discovery_state": "DISCOVERED",
      "integration_state": "NOT INTEGRATED",
      "page_content_obtained": false,
      "retrieval_method": "not_attempted_network_policy_gate",
      "retrieval_state": "BLOCKED",
      "retrieved_at": "2026-10-14T18:48:46Z",
      "state": "blocked",
      "title": "Typography",
      "tls_verification": "enabled_no_request_made",
      "topic_id": "material3_typography",
      "verification_state": "NOT VERIFIED",
      "verified": false
    }
  ],
  "schema_version": 1,
  "source_family": "official_material_io_browser_retrieval"
}
